{
  "$schema": "https://json-schema.org/draft/2020-12/schema",
  "$id": "https://clearworks.ai/contracts/crm-write-intent-request-v1.schema.json",
  "title": "CrmWriteIntentRequestV1",
  "description": "Client-authored request to the CRM authority. requestDigest is SHA-256 of RFC 8785 JCS bytes after removing only requestDigest. CRM, not the client, assigns the durable intent ID and intent digest.",
  "type": "object",
  "additionalProperties": false,
  "required": [
    "schemaVersion",
    "orgId",
    "clientRequestId",
    "requestDigest",
    "canonicalMeetingId",
    "recordVersion",
    "recordDigest",
    "canonicalClaimId",
    "claimId",
    "baseCrmVersion",
    "baseCrmDigest",
    "requestKind",
    "operation",
    "target",
    "proposedValue",
    "proposedValueDigest",
    "evidenceRefs",
    "idempotencyKey",
    "submittedAt",
    "submittedBy"
  ],
  "properties": {
    "schemaVersion": {
      "const": "1.0"
    },
    "orgId": {
      "type": "string",
      "minLength": 1
    },
    "clientRequestId": {
      "type": "string",
      "minLength": 1
    },
    "requestDigest": {
      "$ref": "#/$defs/sha256"
    },
    "canonicalMeetingId": {
      "type": "string",
      "minLength": 1
    },
    "recordVersion": {
      "type": "integer",
      "minimum": 1
    },
    "recordDigest": {
      "$ref": "#/$defs/sha256"
    },
    "canonicalClaimId": {
      "type": "string",
      "minLength": 1
    },
    "claimId": {
      "type": "string",
      "minLength": 1
    },
    "baseCrmVersion": {
      "type": "string",
      "minLength": 1
    },
    "baseCrmDigest": {
      "$ref": "#/$defs/sha256"
    },
    "requestKind": {
      "enum": [
        "system_exact",
        "user_proposal"
      ]
    },
    "operation": {
      "enum": [
        "upsert_account",
        "upsert_contact",
        "upsert_engagement",
        "upsert_interaction",
        "upsert_lifecycle",
        "propose_account_change",
        "propose_contact_change",
        "propose_engagement_change",
        "propose_opportunity_change"
      ]
    },
    "target": {
      "type": "object",
      "additionalProperties": false,
      "required": [
        "entityType",
        "entityId"
      ],
      "properties": {
        "entityType": {
          "enum": [
            "account",
            "contact",
            "engagement",
            "interaction",
            "lifecycle",
            "opportunity"
          ]
        },
        "entityId": {
          "type": [
            "string",
            "null"
          ]
        }
      }
    },
    "proposedValue": {
      "type": "object"
    },
    "proposedValueDigest": {
      "$ref": "#/$defs/sha256"
    },
    "evidenceRefs": {
      "type": "array",
      "minItems": 1,
      "uniqueItems": true,
      "items": {
        "type": "string",
        "minLength": 1
      }
    },
    "idempotencyKey": {
      "type": "string",
      "minLength": 1
    },
    "submittedAt": {
      "type": "string",
      "format": "date-time"
    },
    "submittedBy": {
      "type": "object",
      "additionalProperties": false,
      "required": [
        "subjectId",
        "sessionId",
        "auditReceiptId",
        "policyVersion"
      ],
      "properties": {
        "subjectId": {
          "type": "string",
          "minLength": 1
        },
        "sessionId": {
          "type": "string",
          "minLength": 1
        },
        "auditReceiptId": {
          "type": "string",
          "minLength": 1
        },
        "policyVersion": {
          "type": "string",
          "minLength": 1
        }
      }
    }
  },
  "allOf": [
    {
      "if": {
        "properties": {
          "operation": {
            "const": "upsert_account"
          }
        },
        "required": [
          "operation"
        ]
      },
      "then": {
        "properties": {
          "requestKind": {
            "const": "system_exact"
          },
          "target": {
            "properties": {
              "entityType": {
                "const": "account"
              },
              "entityId": {
                "type": "string",
                "minLength": 1
              }
            }
          },
          "proposedValue": {
            "$ref": "#/$defs/exactAccountValue"
          }
        }
      }
    },
    {
      "if": {
        "properties": {
          "operation": {
            "const": "upsert_contact"
          }
        },
        "required": [
          "operation"
        ]
      },
      "then": {
        "properties": {
          "requestKind": {
            "const": "system_exact"
          },
          "target": {
            "properties": {
              "entityType": {
                "const": "contact"
              },
              "entityId": {
                "type": "string",
                "minLength": 1
              }
            }
          },
          "proposedValue": {
            "$ref": "#/$defs/exactContactValue"
          }
        }
      }
    },
    {
      "if": {
        "properties": {
          "operation": {
            "const": "upsert_engagement"
          }
        },
        "required": [
          "operation"
        ]
      },
      "then": {
        "properties": {
          "requestKind": {
            "const": "system_exact"
          },
          "target": {
            "properties": {
              "entityType": {
                "const": "engagement"
              },
              "entityId": {
                "type": "string",
                "minLength": 1
              }
            }
          },
          "proposedValue": {
            "$ref": "#/$defs/exactEngagementValue"
          }
        }
      }
    },
    {
      "if": {
        "properties": {
          "operation": {
            "const": "upsert_interaction"
          }
        },
        "required": [
          "operation"
        ]
      },
      "then": {
        "properties": {
          "requestKind": {
            "const": "system_exact"
          },
          "target": {
            "properties": {
              "entityType": {
                "const": "interaction"
              },
              "entityId": {
                "type": "string",
                "minLength": 1
              }
            }
          },
          "proposedValue": {
            "$ref": "#/$defs/exactInteractionValue"
          }
        }
      }
    },
    {
      "if": {
        "properties": {
          "operation": {
            "const": "upsert_lifecycle"
          }
        },
        "required": [
          "operation"
        ]
      },
      "then": {
        "properties": {
          "requestKind": {
            "const": "system_exact"
          },
          "target": {
            "properties": {
              "entityType": {
                "const": "lifecycle"
              },
              "entityId": {
                "type": "string",
                "minLength": 1
              }
            }
          },
          "proposedValue": {
            "$ref": "#/$defs/exactLifecycleValue"
          }
        }
      }
    },
    {
      "if": {
        "properties": {
          "operation": {
            "const": "propose_account_change"
          }
        },
        "required": [
          "operation"
        ]
      },
      "then": {
        "properties": {
          "requestKind": {
            "const": "user_proposal"
          },
          "target": {
            "properties": {
              "entityType": {
                "const": "account"
              },
              "entityId": {
                "type": "string",
                "minLength": 1
              }
            }
          },
          "proposedValue": {
            "$ref": "#/$defs/changeValue"
          }
        }
      }
    },
    {
      "if": {
        "properties": {
          "operation": {
            "const": "propose_contact_change"
          }
        },
        "required": [
          "operation"
        ]
      },
      "then": {
        "properties": {
          "requestKind": {
            "const": "user_proposal"
          },
          "target": {
            "properties": {
              "entityType": {
                "const": "contact"
              },
              "entityId": {
                "type": "string",
                "minLength": 1
              }
            }
          },
          "proposedValue": {
            "$ref": "#/$defs/changeValue"
          }
        }
      }
    },
    {
      "if": {
        "properties": {
          "operation": {
            "const": "propose_engagement_change"
          }
        },
        "required": [
          "operation"
        ]
      },
      "then": {
        "properties": {
          "requestKind": {
            "const": "user_proposal"
          },
          "target": {
            "properties": {
              "entityType": {
                "const": "engagement"
              },
              "entityId": {
                "type": "string",
                "minLength": 1
              }
            }
          },
          "proposedValue": {
            "$ref": "#/$defs/changeValue"
          }
        }
      }
    },
    {
      "if": {
        "properties": {
          "operation": {
            "const": "propose_opportunity_change"
          }
        },
        "required": [
          "operation"
        ]
      },
      "then": {
        "properties": {
          "requestKind": {
            "const": "user_proposal"
          },
          "target": {
            "properties": {
              "entityType": {
                "const": "opportunity"
              },
              "entityId": {
                "type": "string",
                "minLength": 1
              }
            }
          },
          "proposedValue": {
            "$ref": "#/$defs/changeValue"
          }
        }
      }
    }
  ],
  "$defs": {
    "sha256": {
      "type": "string",
      "pattern": "^[0-9a-f]{64}$"
    },
    "dateTime": {
      "type": "string",
      "format": "date-time"
    },
    "changeValue": {
      "type": "object",
      "additionalProperties": false,
      "required": [
        "field",
        "value",
        "reason"
      ],
      "properties": {
        "field": {
          "type": "string",
          "minLength": 1
        },
        "value": {
          "type": [
            "string",
            "number",
            "boolean",
            "null"
          ]
        },
        "reason": {
          "type": "string",
          "minLength": 1
        }
      }
    },
    "exactAccountValue": {
      "required": [
        "accountId",
        "name",
        "relationshipClass",
        "status"
      ],
      "properties": {
        "accountId": {
          "type": "string",
          "minLength": 1
        },
        "name": {
          "type": "string",
          "minLength": 1
        },
        "relationshipClass": {
          "type": "string",
          "minLength": 1
        },
        "status": {
          "type": "string",
          "minLength": 1
        }
      },
      "type": "object",
      "additionalProperties": false
    },
    "exactContactValue": {
      "required": [
        "contactId",
        "accountId",
        "displayName",
        "role"
      ],
      "properties": {
        "contactId": {
          "type": "string",
          "minLength": 1
        },
        "accountId": {
          "type": ["string", "null"]
        },
        "displayName": {
          "type": "string",
          "minLength": 1
        },
        "role": {
          "type": [
            "string",
            "null"
          ]
        }
      },
      "type": "object",
      "additionalProperties": false
    },
    "exactEngagementValue": {
      "required": [
        "engagementId",
        "accountId",
        "name",
        "state"
      ],
      "properties": {
        "engagementId": {
          "type": "string",
          "minLength": 1
        },
        "accountId": {
          "type": "string",
          "minLength": 1
        },
        "name": {
          "type": "string",
          "minLength": 1
        },
        "state": {
          "type": "string",
          "minLength": 1
        }
      },
      "type": "object",
      "additionalProperties": false
    },
    "exactInteractionValue": {
      "required": [
        "interactionId",
        "occurredAt",
        "title",
        "accountIds",
        "contactIds",
        "engagementIds"
      ],
      "properties": {
        "interactionId": {
          "type": "string",
          "minLength": 1
        },
        "occurredAt": {
          "$ref": "#/$defs/dateTime"
        },
        "title": {
          "type": "string",
          "minLength": 1
        },
        "accountIds": {
          "type": "array",
          "uniqueItems": true,
          "items": {
            "type": "string",
            "minLength": 1
          }
        },
        "contactIds": {
          "type": "array",
          "uniqueItems": true,
          "items": {
            "type": "string",
            "minLength": 1
          }
        },
        "engagementIds": {
          "type": "array",
          "uniqueItems": true,
          "items": {
            "type": "string",
            "minLength": 1
          }
        }
      },
      "type": "object",
      "additionalProperties": false
    },
    "exactLifecycleValue": {
      "required": [
        "lifecycleId",
        "canonicalClaimId",
        "claimId",
        "recordDigest",
        "bucket",
        "direction",
        "workState",
        "ownerId",
        "dueAt",
        "dependencyState"
      ],
      "properties": {
        "lifecycleId": {
          "type": "string",
          "minLength": 1
        },
        "canonicalClaimId": {
          "type": "string",
          "minLength": 1
        },
        "claimId": {
          "type": "string",
          "minLength": 1
        },
        "recordDigest": {
          "$ref": "#/$defs/sha256"
        },
        "bucket": {
          "enum": [
            "my_task",
            "waiting_on_them",
            "completed_closed",
            "not_a_task"
          ]
        },
        "direction": {
          "enum": [
            "josh_owned",
            "external_owned",
            "shared",
            "unassigned",
            "not_applicable"
          ]
        },
        "workState": {
          "enum": [
            "open",
            "waiting",
            "contingent",
            "completed",
            "closed_abandoned",
            "not_a_task",
            "not_applicable"
          ]
        },
        "ownerId": {
          "type": ["string", "null"]
        },
        "dueAt": {
          "anyOf": [
            { "$ref": "#/$defs/dateTime" },
            { "type": "null" }
          ]
        },
        "dependencyState": {
          "enum": ["none", "unsatisfied", "satisfied", "unknown"]
        }
      },
      "type": "object",
      "additionalProperties": false
    }
  }
}
